{
  "schemaVersion": 1,
  "revision": 0,
  "updatedAt": "2026-10-15T00:00:00.000Z",
  "products": [
    [
      "SKU-WO03-GROUPED-01",
      "WO03 TEST ONLY grouped task 1 — long title for wrapping / 仅测试"
    ],
    [
      "SKU-WO03-GROUPED-02",
      "WO03 TEST ONLY grouped task 2 — long title for wrapping / 仅测试"
    ]
  ],
  "tasks": [
    {
      "id": "REQ-WO03-GROUPED-01",
      "sku": "SKU-WO03-GROUPED-01",
      "name": "WO03 TEST ONLY grouped task 1 — long title for wrapping / 仅测试",
      "client": "WO03 synthetic acceptance",
      "deliver": "场景图 3 张",
      "kind": "场景",
      "status": "scheduled",
      "source": "import",
      "createdAt": "2026-10-15T00:00:00.000Z",
      "updatedAt": "2026-10-15T00:00:00.000Z"
    },
    {
      "id": "REQ-WO03-GROUPED-02",
      "sku": "SKU-WO03-GROUPED-02",
      "name": "WO03 TEST ONLY grouped task 2 — long title for wrapping / 仅测试",
      "client": "WO03 synthetic acceptance",
      "deliver": "场景图 3 张",
      "kind": "场景",
      "status": "scheduled",
      "source": "import",
      "createdAt": "2026-10-15T00:00:00.000Z",
      "updatedAt": "2026-10-15T00:00:00.000Z"
    }
  ],
  "sessions": [
    {
      "id": "ITEM-WO03-GROUPED-01",
      "ids": [
        "REQ-WO03-GROUPED-01",
        "REQ-WO03-GROUPED-02"
      ],
      "date": "2026-10-15",
      "start": "09:00",
      "end": "11:00",
      "place": "WO03 TEST ONLY",
      "note": "Synthetic disposable fixture; no production authority",
      "updatedAt": "2026-10-15T00:00:00.000Z"
    }
  ]
}
