{
  "schemaVersion": 1,
  "revision": 7,
  "updatedAt": "2026-09-22T01:30:00.000Z",
  "products": [
    ["SKU-SINGLE-001", "单任务迁移样品"]
  ],
  "tasks": [
    {
      "id": "TASK-SINGLE-001",
      "sku": "SKU-SINGLE-001",
      "name": "单任务迁移样品",
      "client": "迁移验证客户",
      "deliver": "白底主图 4 张",
      "kind": "细节",
      "status": "scheduled",
      "source": "import",
      "createdAt": "2026-09-20T02:00:00.000Z",
      "updatedAt": "2026-09-22T01:30:00.000Z"
    }
  ],
  "sessions": [
    {
      "id": "SESSION-SINGLE-001",
      "ids": ["TASK-SINGLE-001"],
      "date": "2026-09-22",
      "start": "09:00",
      "end": "10:30",
      "place": "主影棚",
      "note": "单任务场次迁移基线",
      "updatedAt": "2026-09-22T01:30:00.000Z"
    }
  ]
}
